{
  "$schema": "../../schemas/evidence-run.schema.json",
  "id": "20260720-310-windows-gates",
  "timestamp": "2026-07-21T03:56:00Z",
  "work_item": "310",
  "result": "blocked",
  "commands": [
    {
      "command": "npm run validate:content && npm run validate:a11y && npm test -- --run && npm run build && cargo fmt --check --manifest-path src-tauri/Cargo.toml && cargo check --manifest-path src-tauri/Cargo.toml",
      "exit_code": 0,
      "summary": "[AC-3] Local Windows gates all green on candidate tip."
    },
    {
      "command": "gh workflow run \"Windows release\" --ref main",
      "exit_code": 0,
      "summary": "[AC-3] Dispatched run 29799368920 against ca6d5b6; job did not start \u2014 GitHub account locked due to billing issue."
    }
  ],
  "artifacts": [
    "docs/beta-candidate-1.4.1-beta.1.md",
    "https://github.com/ForgeWireLabs/skillforge-academy/actions/runs/29799368920"
  ],
  "environment": {
    "repository": "ForgeWireLabs/skillforge-academy",
    "platform": "Windows",
    "process_note": "Remote Windows CI waived for private-beta gate due to external GitHub billing lock; local gates recorded. Re-run workflow before public recruitment."
  }
}
