{
  "$schema": "../../schemas/evidence-run.schema.json",
  "id": "20260720-310-repopact-2-3-0-release-label",
  "timestamp": "2026-07-21T03:30:00Z",
  "work_item": "310",
  "result": "passed",
  "commands": [
    {
      "command": "pip install repopact==2.3.0",
      "exit_code": 0,
      "summary": "Installed RepoPact 2.3.0 with RELEASE_LABEL support (decision 0026)."
    },
    {
      "command": "python -m repopact_cli validate",
      "exit_code": 0,
      "summary": "[AC-1] VERSION 1.4.1 + RELEASE_LABEL 1.4.1-beta.1 validate; mismatched base rejected."
    },
    {
      "command": "npm test -- --run",
      "exit_code": 0,
      "summary": "[AC-1] Diagnostics app.version resolves to 1.4.1-beta.1 from RELEASE_LABEL via Vite."
    },
    {
      "command": "npm run build",
      "exit_code": 0,
      "summary": "Frontend production build with __APP_VERSION__/__APP_BUILD__ injection."
    }
  ],
  "artifacts": [
    "requirements-repopact.txt",
    "RELEASE_LABEL",
    "VERSION",
    "vite.config.ts",
    "src/diagnostics.ts",
    "governance/owners.json",
    "decisions/0008-consume-repopact-from-pypi.md"
  ],
  "environment": {
    "repository": "ForgeWireLabs/skillforge-academy",
    "platform": "Windows",
    "repopact": "2.3.0",
    "process_note": "Adopted RELEASE_LABEL rather than prerelease-in-VERSION per RepoPact 2.3.0 / decision 0026."
  }
}
