{
  "$schema": "../../schemas/evidence-run.schema.json",
  "id": "20260701-217-android-runtime-retry",
  "timestamp": "2026-07-01T21:15:00-05:00",
  "work_item": "217",
  "result": "blocked",
  "commands": [
    {
      "command": "sdkmanager --list_installed",
      "exit_code": 0,
      "summary": "[AC-1] Android SDK metadata lists CMake 3.22.1, emulator, platform-tools, and Android 35 x86_64 system image only; platform android-35, build-tools 35.0.0, and NDK are not installed."
    },
    {
      "command": "Move-Item C:\\Android\\Sdk\\ndk\\26.3.11579264 C:\\Android\\Sdk\\.temp\\ndk-26.3.11579264-partial-*",
      "exit_code": 0,
      "summary": "[AC-1] Moved the previous partial NDK directory aside after verifying it contained only .installer metadata and no source.properties."
    },
    {
      "command": "sdkmanager \"platforms;android-35\" \"build-tools;35.0.0\" \"ndk;26.3.11579264\" \"cmake;3.22.1\"",
      "exit_code": -1,
      "summary": "[AC-8] SDK manager produced no useful output and was stopped after leaving partial package-operation downloads; no package metadata registered."
    },
    {
      "command": "sdkmanager \"platforms;android-35\" \"build-tools;35.0.0\"",
      "exit_code": -1,
      "summary": "[AC-8] Narrowed SDK manager retry also stalled and left only a partial build-tools .installer directory plus a zero-byte temp zip."
    },
    {
      "command": "Invoke-WebRequest https://dl.google.com/android/repository/repository2-1.xml",
      "exit_code": 0,
      "summary": "[AC-8] Direct access to the official Android repository XML succeeded; exact Windows package URLs and SHA-1 checksums were resolved."
    },
    {
      "command": "curl.exe -L --fail --retry 5 https://dl.google.com/android/repository/platform-35_r02.zip",
      "exit_code": -1,
      "summary": "[AC-8] Direct archive download worked but was stopped after roughly 2.5 minutes at about 3.9 MB of 64.3 MB; observed throughput made the 665 MB NDK archive impractical for this run."
    },
    {
      "command": "Get-ChildItem search for source.properties under Android/AppData/Program Files roots",
      "exit_code": 0,
      "summary": "[AC-1] No existing local NDK source.properties was found outside the current incomplete SDK."
    },
    {
      "command": "npm run mobile:android:init",
      "exit_code": 1,
      "summary": "[AC-1] Tauri Android initialization still fails with: Android NDK not found. Make sure the NDK is installed and the NDK_HOME environment variable is set."
    },
    {
      "command": "adb devices; emulator -list-avds",
      "exit_code": 0,
      "summary": "[AC-3] adb reported no connected/running devices; one AVD is defined: forge_moto_one_hyper_lab_api35. Runtime launch remains blocked before app generation."
    }
  ],
  "artifacts": [
    "work/blocked/217-tauri-android-mobile-support-foundation",
    "docs/android-mobile.md",
    "audits/AUDIT-2026-06-30-android-mobile-foundation.md"
  ],
  "environment": {
    "repository": "ForgeWireLabs/skillforge-academy",
    "platform": "Windows",
    "android_sdk_root": "C:\\Android\\Sdk",
    "required_missing_packages": [
      "platforms;android-35",
      "build-tools;35.0.0",
      "ndk;26.3.11579264"
    ],
    "available_android_packages": [
      "cmake;3.22.1",
      "emulator",
      "platform-tools",
      "system-images;android-35;default;x86_64"
    ],
    "avd": "forge_moto_one_hyper_lab_api35",
    "process_note": "Android runtime proof remains blocked by incomplete SDK package acquisition. A complete NDK with source.properties is the first hard gate; platform android-35 and build-tools 35.0.0 are also missing."
  }
}
